{
  "execution_plan": {"schema_version": "1.0", "plan_id": "issue-484", "revision": 1},
  "issue": {"id": 484, "executable": true},
  "classification": {"primary": "behavior", "concerns": ["backend"], "executable_unit": true},
  "execution": {"allowed": true},
  "workspace": {"branch": {"decision": "required", "base_branch": "main", "suggested_name": "feat/484-card-limits"}, "worktree": {"decision": "required", "reuse_existing": true}},
  "requirements": {"database_migration": {"decision": "not_needed"}},
  "capabilities": {"standard": {"domain": ["backend"], "technology": [], "methodology": [], "artifacts": [], "validation": []}, "custom": []},
  "stages": [{"id": "implement", "type": "implementation", "decision": "required", "depends_on": []}],
  "approval": {"required": true, "status": "approved", "approved_revision": 1},
  "next_action": {"type": "execute"}
}
